,link_id,subreddit,body
403,t3_gdsl2k,edX,"Which one are you considering?

It may depend on the specific MicroMasters, but when I did mine... each class ran from a set date to a set date for the duration of the class.  Start of January to end of February for 8 weeks for example.  

The pass mark had to be reached by the end of those 8 weeks or else it'd count as a fail and I'd have had to pay to resit the next time the course ran.  

For example, with the exception of the capstone exam course I could have done the week 3 test in week 3 when it opened, or I could have left it to the last minute, but the class has a distinct end date.

You don't have to do every class at the same time.  You can do it slower if you'd like, one by one for example.  That may be necessary if you are busy and have other commitments.

I hope that makes sense.  Also I think a few MicroMasters may be being discontinued at the end of 2020 or early 2021 so you may want to double check with edX just to make sure you have time to complete it."
404,t3_gcypyt,edX,Yss sir
405,t3_gcys8l,edX,per class
406,t3_gaeod8,edX,same issue made me leave classes from frustration
407,t3_gackao,edX,"[How to learn online](https://www.edx.org/course/how-to-learn-online) 

The rest will depend on what you want to do, what you want to learn and how much time you have"
408,t3_ga1dz4,edX,"Is this article sponsored by Grammarly. It's pretty broad until you get to that fifth item. A computer, internet connection, some software and Grammarly?"
409,t3_g9rntk,edX,I don't think that edX certs would really count as anything official
410,t3_g9a4d4,edX,"Edx certificates aren't worth much of anything.

I'm just a UI dev but I imagine in law the equivalent of self made coding projects would be published papers via think tanks, journals, and less ""general newscycle bs"" media like Diplomat or The Economist.

Perhaps you could get some research and potential points of contact from your coursework and then write. I freely emailed some economists after a couple econ principles courses and actually got thoughtful replies out of them on their opinions and even some career advice! Just make sure you stand out by mentioning how came across them and what you think of at least one of their papers."
411,t3_g8l11s,edX,"Right now, there’s a free certificate for the course about how to learn online. It’s a quick and helpfull course during these times."
412,t3_g84ck0,edX,Midnight UTC.
413,t3_g7pvgw,edX,How did you get the free coupon?
414,t3_g7bsl7,edX,"If you are talking about Statistics Fundamentals course, then there is officially no required textbook. The only recommended book is Concise course in statistical inference, by Wasserman. I think it is available online."
415,t3_g6w23x,edX,"You better start a MicroMasters. Some of them carry credits towards a real MS degree. While maybe they’re not offered by the university you’re applying to, it sounds better than “just a microBachelor”"
416,t3_g5bklv,edX,"I assume you mean the micromasters in data science?
You'll struggle without strong knowledge of calculus and linear algebra. 

They will teach you R in the data science for social scientists module. You also need to learn python or you'll have a hard time in the deep learning course."
417,t3_g5byjz,edX,Are you on a vpn?
418,t3_g505ap,edX,"They will help in the capacity that you are learning valuable information, 'Justice' in particular is a very good course and can help you understand different conceptions of what is right and wrong.

In terms of completing your law program, or future employment, the certificate from taking the verified course most likely won't help you at all. I still encourage you to get one if you plan on finishing a course, buying certificates helps fund the platform to continue making courses."
419,t3_g44ehs,edX,"I took this course and am able to see the archived version. However I recommend that you download what you will want to see again just in case. I took one course from MIT that I can no longer see at all, that course cost almost $1k and they confirmed that I will have to pay for it again if I want to see the updated content. But in my experience this is the exception rather than the rule."
420,t3_g3ztzw,edX,"No, it does not."
421,t3_g3e2c2,edX,"Sorry i have to continue bon this rant. I neglected that i've actually paid for the course! For this particular program one needs to pay up front for every course... So, you'd think maybe you'd get an email regarding course dates? Course date changes? Course availability? Guess not!"
422,t3_g33e2u,edX,"As far as I know, different courses have different approval workflows. Keep in mind that you may only get 5 financial assistance approvals in a year’s term, and the current crisis is also delaying some replies."
423,t3_g1vfpn,edX,"1) not in my experience
2) you can pay for the certificate up to the course certificate deadline."
424,t3_g13lvi,edX,"I've done a number of interviews recently and you talk about work experience, skillset, and to a less extent, education. This was for business analyst positions, so maybe a bit different, but the discussion of having completed any courses with a verified certificate didn't really ever come up.

You could make the point that having it listed on your LinkedIn profile or resume could help land interviews, but again something like that isn't going to stand above your work experience nor your connections. I think getting the skills from the course and then applying it somehow to your own project would be significantly more beneficial."
425,t3_g0afet,edX,Yes you need to pay for the certificate
426,t3_fzrs3j,edX,"I can't speak for your course, but in the courses I've taken I can't go back to see the quizzes. They are released at a specific date and time and access expires when the exam is due. 

So I'd say no"
427,t3_g05okn,edX,when you enroll in the university ( college ) classes are expected to pass also?
428,t3_fyt4i6,edX,Coursera and Edx have both gone full for-profit. It’s pretty sad.
429,t3_fyvca5,edX,Do you have a passport?
430,t3_fx4ama,edX,"https://www.edx.org/course/?availability=current should be displaying only the current courses, and you can use the filters on the left to narrow it down by subject area. Good luck!"
431,t3_fwswsr,edX,"If courses have prerequisites, they are usually listed on the course page. As for accreditation, some courses do offer it, others don’t. When they do they can usually be used only at specific universities. If they offer accreditation, it will say so on the course page."
432,t3_fva2yi,edX,"I'm on the very verge of finishing the entire program - I have lost a lot of sleep and a lot of my life to finishing this micromasters. My motivation to complete it is to earn a raise at my job which is essentially the only reason I will finish. I was a total beginner in ML and I think this coursework does a great job of quickly but challengingly getting you up to speed with the basics. I will honestly say, no one could possibly pay me enough to do it again, but now that I am near the end it feels incredibly rewarding, and very applicable to my role as a junior data scientist at my company that is already doing machine learning. My advice for anyone considering starting:

1. Take one class at a time if you work full time or don't have 30 hours a week to dedicate to the classes. They are rigorous, and it is easy to fall behind.
2. Suggested order: Probability, Statistics, Data Analysis in Social Science, ML in Python - this is not the order I did it in but it would have been a much better choice
3. To earn the certificate in the specific classes, you only need 60% - for me, just the certificate matters and not the actual grade - I make sure I attain a 60% before the final exam and skip the final. The course content is available for up to a year after the class has finished and it is possible use the final exam answers to study later for the capstone :) 
4. Make cheatsheets throughout the course material - will make studying for the capstone much easier IMO and then your cheat sheets area already done"
433,t3_fuw3fw,edX,"It takes a while to get verified. You’ll get one email saying “verification photos received”, and then another “verification approved” (or rejected). Once it’s approved it will show up on your dashboard."
434,t3_ftjwru,edX,"Im in that same course. If I remember correctly I think they actually did away with all due dates due to everything thats going on with the exception of the final due date, which was pushed back to May 6th. If you check the discussion forum you should see that announcement. You need a 60% grade total to pass and get a certificate. As long as you can manage that youre fine!"
435,t3_fr3rge,edX,Sometimes the courses don't actually start until 7 pm. Try it tomorrow
436,t3_fpzkjo,edX,You would unfortunately still have to wait.
437,t3_fpkkfj,edX,"I work with Open edX (the open source version of edX) and ""**Answer:** optional acceptable variant of the correct answer"" is the default answer text they're supposed to replace for optional answers (here's [the default template](https://i.imgur.com/Uutaehd.png) for free-text questions, spot the line they didn't write!). Basically, they set up their question wrong.

You should notify them about it and ask them to fix it and reset your attempts, and let them know where the error is, because you've done nothing wrong and by letting them know you can get them to fix it for everyone."
438,t3_fnu4sz,edX,"Hey, I just started this program myself. I noticed that some of the courses are listed as 'currently unavailable'. Did you encounter this issue at all? Specifically Accounting, Corporate Finance, and Organizational Behaviour."
439,t3_fnk0dp,edX,"It's for everyone who wants to learn something new, there are courses for all levels. Whether it's ""worth it"".. well that depends on what you want to get out of it. There are many courses covering a large range of topics. Some are part of specializations/programs, which are collections of courses with a common theme (and sometimes increasing in difficultly). 

Courses are free to audit, but you pay for certificates - and sometimes some of the content. (You can apply for financial assistance if you cannot afford the course.) Personally, I audit most courses, but I recently paid for a programming course, because I thought it would be useful for a job application.

If you are looking for courses that count towards your degree, you will have to take that up with your university/department. I'd say picking some semi-random courses and hoping for the best is not going to be worth it.

If you're looking to learn more about the topic of your degree, and perhaps put yourself at an advantage for when you do resume your education.. then maybe try looking up a syllabus and see if you can find similar courses on EdX. That might very well be worth it.

If you just want to learn something new about a topic you're interested in, and need a structured way to go about it. Enroll, and have fun, definitely worth it."
440,t3_fnlaem,edX,"Yes  you are entering in the middle and have to cram. Both courses have weekly assignments  


For data science: you can start now but you have already missed many deadlines. I'm in the course right now. You need to pass the course and then enroll in the final assessment to get a certificate. It's weird but that's how it's set up. The course ends next month. You'll be learning from the 2019 Nobel prize winning professor of economics, there's a lot of R and web scraping as well as probability. 

For the probability course, I took this last year, and if you plan to enroll for credit, it many no longer be mathematically possible to pass. There's very likely a midterm coming up very soon that you'd have to do a ton of work to catch up. If you register in audit mode you won't have to pay anything and can see the midterm schedule and grading policy that should give you a good idea of whether you can still pass. They drop a few of the graded exercises so the zeros you'll have on some of the earlier assignments won't hurt you. 

You can certainly enroll in both courses in audit mode without pursuing the certified track then sign up again next time they are offered. This will give a head start."
441,t3_fnl8rn,edX,You can represent your knowledge gained from there.
442,t3_fmbgzf,edX,"&gt;	do these courses translate to paper/resumes? 

There is nothing preventing you from adding coursework to your resume. I have a section of my resume under “education” labeled “other coursework” Which contains any relevant on my courses. I imagine that it would be weighed or considered similarly to a single non-credit course; that is to say, it’s very unlikely that a single online course is going to make a difference in your job hunt. It does tend to demonstrate that you are an autodidact, and all employers want someone who can grow and learn.
&gt;	Further to this, are these courses good? 

Some yes, some less so. There’s a lot of variance in quality, so asking this question is roughly similar to asking “how good is a chemistry course” without specifying which course it is, which university of that, which professor is teaching it, etc. however, the opportunity cost of trying of course is pretty low. It’s free, and within 20 or 30 minutes you should start to get a feel as to the quality of the course. My recommendation is that you go for it: find a course with good reviews and try it, and if you don’t like it, try another, and if you don’t like it, try another."
443,t3_fm61j8,edX,What I've learn from asking that question on other forums is most jobs look at your projects. I think using EDX to learn would be good if you have any experience and then to develop a portfolio with projects once you get a better idea of what you are doing.
444,t3_flkx55,edX,It varies depending on the MicroMasters course. Some of the MM programs are not actually accepted by the teaching institution involved. Check the MM page for more information.
445,t3_ffoj3p,edX,[deleted]
446,t3_feo8ck,edX,"Same here, there are so many opportunities involved with this course,I'm afraid I'm going to have to audit the course, I just wonder if it is a complete waste of my time to audit the course now and then pa when I'm financially secure"
447,t3_fdippn,edX,[deleted]
448,t3_fcw4af,edX,"Hi! I work at MITx, so thought I could provide some helpful information. The deadline to purchase a certificate in this course is today (I don't know what time, unfortunately), and there are some assignments restricted to learners who upgrade. That said, if you did join the course and upgrade today, you should still be able to pass the course - we try not to allow learners to purchase a certificate if they can't still get a passing grade.

If that doesn't work for you, while it isn't scheduled yet, I can promise that this course will be running again :)."
449,t3_fbxjld,edX,Same with me. Tell me if you make it work
450,t3_fbmguh,edX,Maybe go to LinkedIn and ask Anant directly?
451,t3_faznpi,edX,"I’d recommend doing that. When you go to buy the package, they’ll just subtract the cost of the first class out and still give you the 10% discount."
452,t3_faqvac,edX,"You should be able to if it's offered. I've done this with several courses when I didn't have time to complete them

You can always email edx support. They should respond pretty quickly."
453,t3_f6itpd,edX,You pay to receive a certificate. It is a PDF that you can print on your own if you’d like.
454,t3_f6c93u,edX,I don't think JavaTutor is publicly accessible.
455,t3_f3kmly,edX,I'm taking it right now. The book is really good. I'm also mostly through the Microsoft track in AI which is outstanding.
456,t3_f0mf69,edX,"I believe the difference is that one certificate is from HarvardX via edX while the other is from taking the online course through the Harvard Extension School, which is Harvard's online offerings."
457,t3_eyaj09,edX,"hey, do you take it? i wanted to know if it is worth it and about the questions"
458,t3_evwwui,edX,"My understanding is that the enrollment deadlines and course completion deadlines are set regardless of if or when you pay.

The reality of edx is that many classes have moderators or teachers who only spend time on that class for a certain window of time. 

Whatever the course deadline is, it's the same timeframe if you purchase it before the class starts or the day before the deadline."
459,t3_er8x3z,edX,"I have been taking notes and attempting to do the readings (have not gotten to all, but probably 75% at least)... I've been saving the readings as PDFs when possible.  Would be nice to be able to go back to the full course content indefinitely but I believe that's not possible, as they get archived after courses formally end.  To make my notes more useful, I've been structuring them as follows and attempting to be diligent on the last few parts:

* I take notes on all the course content as I go through it (I use Microsoft OneNote but you could use a Google Doc or whatever...)
* I maintain my own glossary of new terminology I learn about 
* I keep track of things I want to come back to, like links that were introduced to other pieces of material not actually required by the course... things that sounded interesting to me but don't really have time to do right now
* Try to keep a list of things that are directly applicable to my personal work/goals (i.e. why I took the source in the first place)
* At the end, I plan to write myself a summary of the course, which will be a single page or two explaining what I learned, the key things I took away  from it personally, and resources to refer back to down the road.  This is probably the most important thing to not skip, in my opinion.

Of course, the specifics of these things is going to vary based on the type of course you are taking, but I imagine the general concepts are pretty universally applicable."
460,t3_eqz3tf,edX,"Have you looked into Walmart's education programs? You can get a bachelor's degree for a $1 a day (so about $360 a year, along with reimbursement for anything you spend textbooks). It's only for certain subjects, but I know they offer a few in stuff like IT and cybersecurity, along with others I may have forgotten.

I think on Walmart One it's under something called ""ULive,"" but it's done through Guild Education. It's definitely worth considering."
461,t3_epe959,edX,In very limited universities and for very limited programs. Like for example if you complete Data Science and Statistics micromasters you can get certain courses considered when applying to PhD at mit or master's degrees in list of universities. https://micromasters.mit.edu/ds/. But generally it doesn't work one to one.
462,t3_eoxojg,edX,"All videos are pre-recorded and posted sometimes weeks in advance. You can watch and take tests anytime. There are weekly deadlines, midterms and final exams. Don't know your background, but these courses required intense involvement, up to 3 hours a day, including weekends, to stay up to date."
463,t3_enntmg,edX,"No, although you get a nice looking printable certificate with a URL on it that viewers can use to validate."
464,t3_elzj7p,edX,"I can only give you information about the statistics and data science micromaster:

You are given automated tests and no individual feedback but there are quite active forum discussions and (sometimes) quite detailed solutions for the problems.

But you have to realize that you are pretty much on your own while doing homework problems and unit exercises because it is forbidden to discuss any of the ""active"" problems in the forums. Once they are graded you are free to discuss the problems in the forums but I hardly ever did that because I did not really have time to get back to solved problems because I had a hard time to keep up with the coursework.

It took me days to finish some of my homework assignment and some of the unit exercises because they are HARD. The exams for the courses are 2 days take home exams and open book so can use any ressource to tackle those exam questions (you will need this because they are hard too).

The final capstone exams are closed book 2 hour tests. So you have to be proficient (and fast!) in solving quite tricky math problems. And I have to add that only correct answers count any points. If you made some error along the way you loose all the points for a question

And unless you are already pretty good in linear algebra, calculus, probability theory, programing and statistics you will have to invest considerably more than 14h per week per course.

The coursework is also very theoretical."
465,t3_egzr7h,edX,"You can definitely pay for the first couple of classes individually, then purchase the remaining courses at a discounted price. 

Source: I work at MITx :)."
466,t3_efjtde,edX,"Coursera has a built in note taker.
Check it out if you want some inspiration."
467,t3_ef0dwb,edX,"check it out,

[https://www.edx.org/edx-terms-service#rules-for-online-conduct](https://www.edx.org/edx-terms-service#rules-for-online-conduct)

&amp;#x200B;

&gt;Furthermore, you agree not to scrape, or otherwise download in bulk, any edX Site content, including but not limited to a list or directory of users on the system, User Postings or user information, online textbooks, course materials, or trademarks and logos.

So, people using this tool will be jeopardizing their edx accounts.  But, that's a surprisingly terse program for parsing command line args, handling authentication and scraping - in only 200 lines of code."
468,t3_eegn5z,edX,I can put you in touch with the UMD staff supporting this MicroMasters. Let me know if you’d like to learn more.
469,t3_edycib,edX,Just download them. I don't know that there's any other solution
470,t3_edity7,edX,"I did the 6.001x.  The 2017 python version covered things at pretty much at the same level as the 6.001 scheme version did in 1981.

If anything the little quizzes that Edx had between sections came more often than the weekly cadence of recitations, which was nice."
471,t3_ecw55x,edX,"https://www.edx.org/course/introduction-to-python-for-data-science-2 specifically speaks of numpy, pandas, and mathlib. https://www.edx.org/course/introduction-to-computer-science-and-programming-7 might also have it"
472,t3_eb8biu,edX,Also to be clear I know this is not a community run by EDx. Just want to know if people have had experiences like the above at all
473,t3_eb4w8m,edX,"In my experience, you need to enroll by Jan 15 to continue having access to the course. That means that if you don't pay for the certificate, you won't be able to access the course anymore and all progress will be lost. 

Every course is different so I can't answer about the textbook. I didn't know these courses came with textbooks?

If you are not going to continue you can print out your notes to PDF in case you want to enroll again in the future"
474,t3_e77ylp,edX,"I cant speak on the courses youre talking about. But I have taken 6.00.1x and 6.00.2x, which are intro classes for programming and data science using python. They are through MITx (MIT’s online learning intiative) and are based on their on campus equivalents. The material it is based upon is available on their opencourseware page if you want to take a look. I think theyre great courses, the first one in particular. They are a couple of the more highly regarded courses I have heard of associated with edx, so I would look into those if I were you. Their should be another iteration starting in the next couple of months."
475,t3_e6h74o,edX,email info@edx.org
476,t3_e1dfug,edX,"Here's the typical undergraduate calculus progression:

[https://www.edx.org/course/calculus-1a-differentiation-2](https://www.edx.org/course/calculus-1a-differentiation-2)

[https://www.edx.org/course/calculus-1b-integration-2](https://www.edx.org/course/calculus-1b-integration-2)

[https://www.edx.org/course/calculus-1c-coordinate-systems-infinite-series-2](https://www.edx.org/course/calculus-1c-coordinate-systems-infinite-series-2)

[https://www.edx.org/xseries/mitx-18.03x-differential-equations](https://www.edx.org/xseries/mitx-18.03x-differential-equations)

Looks like there is a linear algebra course from rice on edx, if you need the certificate. If you just want the knowledge, personally, I would just use this one: [https://ocw.mit.edu/courses/mathematics/18-06sc-linear-algebra-fall-2011/](https://ocw.mit.edu/courses/mathematics/18-06sc-linear-algebra-fall-2011/)"
477,t3_dzeidm,edX,same problem here
478,t3_dur16g,edX,"Software Development Manager here. This may depend on where you are in the world, here in the UK the market for Developers is very competitive. It’s quite rare for a developer to be placed in a role without going through an agent first.

Agents, despite there best efforts, do not understand the technologies that developers put on their CV. They are doing a basic match on CV’s in their Database.

In this situation it isn’t beneficial to withhold skills from your CV. Managers that do the hiring through these agencies know what they want and can happily ignore the rest. 

Personally, I think it’s nice to see a wide array of skills. It tells me quite a lot about you when compared against your time in education or industry. You do have to be careful only to list things you are proficient in, though."
479,t3_dta9mu,edX,"1) You have to be accepted into the NYU program

2) Completing the Micromaster's does not guarantee admission to the Master's program"
480,t3_dsy9zf,edX,[deleted]
481,t3_ds0ck5,edX,There are a couple of edx courses that offer undergrad credits. Mainly these  [https://www.edx.org/charter-oak](https://www.edx.org/charter-oak)
