,link_id,subreddit,body
762,t3_3o4zcc,edX,"I know this is a EdX subreddit but people can benefit from this class. This is a private link I share with Reddit users and the class is free to join - You do not have to pay anything, you just need an account to enroll. If you don't know Skillshare it is a great fast growing learning platform with lots of project-based classes on various topics. IF you would like to join other paid classes later on, then you will need a subscription."
763,t3_3nv16o,edX,"X-Post referenced from /r/IAmA by /u/MichaelJSandel  
[I am Michael Sandel, political philosopher, author, and Professor of Government at Harvard University. AMA.](https://www.reddit.com/r/IAmA/comments/3nuzvt/i_am_michael_sandel_political_philosopher_author/)
*****  
  
^^I ^^am ^^a ^^bot ^^made ^^for ^^your ^^convenience ^^\(Especially ^^for ^^mobile ^^users).  
^^[Contact](https://www.reddit.com/message/compose/?to=OriginalPostSearcher) ^^| ^^[Code](https://github.com/papernotes/Reddit-OriginalPostSearcher)"
764,t3_3np82s,edX,"Hi there - I see you also reached out to edX via Twitter. I checked with our Support team and it looks like someone got back to you this past Sunday. Did that help resolve? 

Also, my apologies for the delay in response; r/edX is not intended as an avenue to contact edX Student Support. I've noticed an increase in this type of post, so will create an FAQ or sticky for the sub as soon as I'm able. (Thank you though, and do let me know if this issue still needs attention!)"
765,t3_3nf77z,edX,"Usually that's not possible, but quite often it is possible to upgrade during the first several weeks of the course. "
766,t3_3mf24w,edX,"Hi ! their presentation video has just poped up on the YouTube channel of edX, so I guess they are going to roll back their material pretty soon."
767,t3_3l6yxp,edX,"Great question. I'll try to track down the official answer for you, but I believe that you'd have to pass the AP Calculus exam to get it listed on your high school transcript, regardless of what course you take. Your high school guidance counselor should have more information on this as well. "
768,t3_3l2tlu,edX,"No experience with them, but I would just view then as a +1 education stat on a resume. Nothing to really speak about in an interview."
769,t3_3l4a3n,edX,"Do you mean which course/s might help people looking to help a poor child? 
Unfortunately [Global Poverty](https://www.edx.org/course/challenges-global-poverty-mitx-14-73x) and [Positive Behavior Support for Young Children](https://www.edx.org/course/positive-behavior-support-young-children-uwashingtonx-ecfs312x-0) are both currently archived, but with any archived course you can still enroll to get updates on when it will re-run. 

If you're looking for free courses that will help a child who can't afford the courses, edX has a slew of free courses for students as young as (I believe) 10 years old, including the learn-to-code [Scratch](https://www.edx.org/course/programming-scratch-harveymuddx-cs002x-0) course for all ages, and AP* prep in biology, chemistry, psychology, etc. "
946,t3_y2a1a6,coursera,They kinda complement each other. You get a double badge as they’ve partnered up. I’m doing now and enjoying it. Worth to be honest but A+ is more industry standard.
947,t3_y1qayn,coursera,"I am a dev with no 4 year degree. I got my first role via TripleByte (a recruiting startup) and they famously dont care about resumes.

I did some courses, but they were not really a major contributor to my first job--at least in terms of on-paper appeal.

I learned a lot, from them--but I don't think I was hired because of the certificate itself.

I have been at both Facebook and Amazon, and neither would consider someone without experience (although we have a program at Amazon for training any internal employee to be a developer). Smaller shops are much more likely to take a chance on you."
948,t3_y1ltov,coursera,Apply for financial aid then you get the certificate. Before I learned this I still put the course on my resume. I don’t think they do much. But they’re fun.
949,t3_y15axd,coursera,"I believe most 100% online degree is not eligible for F1, hence no OPT as OPT is part of F1. It is highly unlikely to get H1B thru coursera education imo"
950,t3_y0jgzw,coursera,"I don't know which course you are talking about, but I have never seen any course with that requirement. Even a full-time program would only be 40 hours per week. I would think this is is a typo and relates to the overall course duration."
951,t3_y0a8wb,coursera,"If you are currently enrolled in the course, you won't be able to see the FinAid option, you will need to unenroll, and restart the process"
952,t3_xzsz7k,coursera,"Most likely your subscription will be canceled, but you can restart it with the correct credit cards, your progress will be saved. This is actually very normal."
953,t3_xyurzb,coursera,You will not
954,t3_xyo319,coursera,"The course is free, the membership is not. It’s $40/mo to have access to all of the free courses on the platform. I don’t think there is a way around it. You could maybe fit all of your course work into a week? Or at least a month."
955,t3_xwzz23,coursera,"it depends, did you have an IT related undergrad degree as well? also how much does the job pay, if you're comfortable answering the question"
956,t3_xx0p32,coursera,Hi! You don’t usually have to redo anything that you complete within a free trial. Did you get your certificate? Maybe send their customer services dept. a message to get some clarification over what’s happened?
957,t3_xw7dft,coursera,"The email sent by Coursera is basically telling you that Student Plan account will be closed, and you no longer access free courses using the University student email, **Not personal email accounts.**

If you access Coursera as a normal user, you can access almost every course in the website.

If you enrolled in a course using the Student email account and you haven't finish it yet, you can finish it before november this year.

The progress for any course used in student plan program will be saved, you can re-enroll using your personal account to continue where you left off.

The next step is to add your personal email to your account to enable access for the courses you previously working on the student plan program even after 2 of November this year.

Edit: To be honest, the student plan program was useless, as it offers 1 free course per year, where the normal user can apply for financial aid and wait 15 days to access the course (Maximum number is 10) freely."
958,t3_xw7gaf,coursera,I’m wondering about the financial aid aspect as well. Can we still apply as non-students?
959,t3_xvjbs3,coursera,"There are multiple tabs on your home screen. Your screenshot is probably the Home tab (it's cut off but would be above the screenshot). Click ""In progress"" to see all your courses."
960,t3_xu6x4s,coursera,Can you explain to me how to sign up for the course via financial aid? I want to also do this same course! Thanks!
961,t3_xu8fhy,coursera,No.
962,t3_xsqoud,coursera,"Awesome, thank you! Be sure to put the share link if you're happy with the grades you received. I have a lot of Coursera certificates and it hasn't been unheard of for problematic people to accuse me of lying on my resume. The share link shuts them up quickly, which is why I love it. I wish they had something similar for all the rest of the parts of the resume, like a hiring certificate with a share link that you received when hired at a place of work. Sick and tired of being told the incredibly difficult work I did is somehow subject to ""guilty until proven innocent"". I would of course not even apply to such places if that's the philosophy I knew they ascribed to, against basic justice. Nevertheless I deal with them far more often than is acceptable, demonstrating the power of Coursera's share link."
963,t3_xt8hx1,coursera,"Discussion prompts are optional, you don’t have to complete them to get the certificate."
964,t3_xsk27g,coursera,"Certificates are there to celebrate your achievement of finishing the course, make sure you make the most of your course, do some projects to demonstrate your expertise and you are all set,"
965,t3_xrxboy,coursera,"Not natively in Coursera but you can download an ""ical"" (calendar file) for each course and import them to a software such as Outlook.

BTW they are not 'hard' deadlines in that sense."
966,t3_xrc7nd,coursera,Exactly same issue for me
967,t3_xr8eqp,coursera,"It’s the tech parsing the audio waveforms. They should have a crowdsourced transcript annexing the AI one, and pay people small amounts for scribing and correcting. Then they can go back in and decide which is more accurate. Try floating that idea in an email to support. If they ignore it you might be able to get disability advocacy."
968,t3_xpbwey,coursera,"Congratulations! I’m doing the same one. Did you download all of the sheets and docs to google drive? That’s what I did and created a folder.

Or are you wanting the videos and such?"
969,t3_xp92s8,coursera,"From my experience, it takes about 24 hours for it to get reviewed by someone. My course was Google Project Management so maybe the number of people available was higher."
970,t3_xpb42i,coursera,"I don't think it's that simple, coursera isn't like udemy, they only publish organizations afaik"
971,t3_xm20qd,coursera,How will they connect the two?
972,t3_xlmvts,coursera,"The analytics one was so bad, couldn’t bring myself to finish it"
973,t3_xlqs78,coursera,I believe so.
974,t3_xlbk1k,coursera,"If you’re paying for a monthly subscription, that covers most of their courses. If it’s a degree course, you’d probably need to speak to their customer services department directly to see if they’ll let you swap."
975,t3_xki5m9,coursera,Great question. I am considering doing it as well and I had the same question but mine is business vs IT related. Can anyone help with this?
976,t3_xk0x8j,coursera,I’ve managed to complete quite a few courses within the 7-day trials.
977,t3_xjvnut,coursera,I would add it to your CV. What I do is say when the expected completion date would be. This way employers know that you will have the certification in the near future and could still consider hiring you.
978,t3_xjmf4o,coursera,"""Dog Emotion abd Cognition"" is what you need if you are focusing on a CS education!!"
979,t3_xitf5p,coursera,dm me
980,t3_xijerj,coursera,Maybe try a different browser like chrome and see if the issue still persists
981,t3_xf4ygx,coursera,"I know what you mean. I feel like a lot of people aren't even checking work, just hitting buttons. 

If you message me a link to your project I would be happy to give some feedback."
982,t3_xez5pg,coursera,Nope! The coffee house stuff is just an example project to test concepts on before doing your actual projects. I ended up skipping most of them too around unit 3 or 4 and going straight into my main projects with the lesson info
983,t3_xev76x,coursera,"Find people on LinkedIn that have that and talk to them. 

Or add it to a resume with a different name and similar experience as yours and apply to jobs and see if it helps."
984,t3_xef6uw,coursera,"Yes, you will."
985,t3_xe5psn,coursera,"Hey I am just starting the Data Analytics course and would love a partner, how far along are you?"
986,t3_xddiff,coursera,Usually they offer the option to buy it at the end of modules or locked quizzes. Probably there is an alternative way to buy it in case you don't see it
987,t3_xdg7wb,coursera,Yes. I still have access to my completed course even though I have no more coursera subscription.
988,t3_xcngx4,coursera,"Outside of a subscription, you still get new 7 day free trials for any courses you haven’t started before. I think all of the courses require a subscription after the trial, except the degree courses."
989,t3_xcagnr,coursera,If you audited the course you can apply for financial aid anytime
990,t3_xaywmt,coursera,Click on enroll then hit hit audit
991,t3_xanfv6,coursera,"They’re not useless. Apart from then in-depth knowledge they offer, some universities take it for credit. The IT SUPPORT in particular is very popular. I used it for my WGU admissions and though it only took care of the 4 credits for Intro to IT, it’s something at least."
992,t3_xaso61,coursera,I used Coursera as supplemental material for the more difficult courses in my CS degree. Maybe use Coursera to learn new skills and build an online portfolio (website/GitHub) for interviews/LinkedIn?
993,t3_x92fjz,coursera,"When I had this problem (it's been a couple of years now), I had to contact Qwicklabs themselves and they were able to get me access to some things, but simply passed me for others without actually having done that (which was a disservice)."
994,t3_x8zdns,coursera,"No, it doesn't roll over. Financial aid is specific for each course you apply. 

If you finish before the allotted time I have no idea what will happen though 🤔"
995,t3_x90o0m,coursera,"Just search the course in coursera and then click audit. If it says your aid will be cancelled once enrolled, just ignore that it is only for those who are in the free trial period."
996,t3_x8mcwl,coursera,Anything google or cloud should help one get hired
997,t3_x8b1vv,coursera,"They are, but be aware that most of them are in competitive fields or ones with strict hiring requirements where a vocational certificate from an institution with mediocre respect like Coursera doesn't make you a shoo-in for a job. Like, if you go to to a community college and get a nurse aide or hvac technician certificate, finding a job will be really easy because of the nature of those careers."
998,t3_x7adwr,coursera,Maybe reach out to a recruiter from Facebook on LinkedIn and see what they say. They may have a certain number of positions set aside for people who complete the course.
999,t3_x6ir83,coursera,Yes. You can even do the quiz and just write down your answers in word then submit the quiz when you have full access so you don’t forget everything.
1000,t3_x6amv5,coursera,Yes
1001,t3_x4m1zb,coursera,"This is a technical issue with their platform so no one here can really assist you.   
I'd contact support again and let them know your issue hasn't been resolved as a support ticket should't be closed before the issue has been resolved."
1002,t3_x2v6gy,coursera,"The monthly vs. fee per course appears to just be a decision by the course creator. Most are monthly subscription, there's a few flat fee courses out there still. The monthly sub doesn't automatically include every course, it only includes the specific course or specialization when you sign up on the course/specialization page. 

The exception is courses in Coursera Plus, which is a subscription service with thousands of courses. To clarify, even if a course is in CourseraPlus, you can still sign up for it individually for cheaper on the course page. I've completed 2 specializations, neither are in Coursera Plus. 

The certificates that you've completed should be in your ""accomplishments"" section, they don't go away when you stop paying. I've seen Coursera even auto-cancel my subscription when I completed a specialization. Sounds like maybe they just scrubbed that course completely from their platform, you'd have to ask them."
1003,t3_x1c51x,coursera,Agree. I join courses just so I don’t forget about them.
1004,t3_x0ohi7,coursera,I have already applied for about 50 courses and selected 0$ as the option. All my applications got approved so far.
1005,t3_x0ctnt,coursera,"Huh, I never upload pngs for this course. Try compiling everything into 1 pdf file."
1006,t3_x02v52,coursera,"Contact support, say you made a mistake and ask for advice on how you should proceed.  


-------  
##How to contact live support ?

1. Go to [Coursera Support](https://www.coursera.support)
2. Make sure to login (*""Log in""* button top right in navigation bar)
3. Chat bubble should appear in the bottom right corner after you login.
4. I believe the chat bubble only appears during certain hours, I'm guessing US time zone"
1007,t3_x02uz9,coursera,Contact support and explain everything and ask if it's possible to merge the two accounts.
1008,t3_wzyzrz,coursera,You can. Just do the quizzes and you'll be done with it
1009,t3_wzuuni,coursera,"I can access all materials and assessments for that course yes - I have a 'plus' subscription paid for personally, not associated with a college etc."
1010,t3_wz96jq,coursera,"It depends on your university that you want to transfer the credits to tbh . Some might accept the same certificate while others don't (even if it has ACE accreditation or college credit). You can't expect them to just fit a random course you took towards your degree. So what I would do is call the school or if they have a partner's page before taking anything on coursera, and if you already did, I would ask whether my certificate is transferable towards my degree or not. or maybe submit an evaluation. Hope this helps!"
1011,t3_wz5807,coursera,"The course appears to be relativley new so there will probably not be too many reviews online about it. Worth it is relative, if you don't do this course what will you do? What do you hope to gain out of this course?"
1012,t3_wykmgu,coursera,"The degree is still in development and not enrolling students, so you'll probably need to wait until they finish the development before getting more information."
1013,t3_wykl37,coursera,"What positions are you looking to apply for? 
What's your current masters in?"
1014,t3_wxiwns,coursera,Idk man everybody tells different story.
1015,t3_wxkpgo,coursera,PM for help
1016,t3_wxek5m,coursera,"It's good to hear that you got approved on financial aid. As per my knowledge and my experience , Coursera will allow you to again apply for financial aid. Same situation happened with me and fortunately I got approved again , so yeah ! You can apply for the same course again even though you have previously financially approved for the same.

Thanks !"
1017,t3_wx5ez8,coursera,"Andrew Ng courses. Which include but not limited to:
Machine learning Specialization and Deep learning Specialization"
1018,t3_wxahio,coursera,Once you have the certs you dont have to pay. You can complete as many courses as you can within 7 days and get certs for that
1019,t3_wx5570,coursera,Find documentaries
1020,t3_wwc9n6,coursera,"I have the same problem. I tried through app on my phone and it shows that some of modules work, however I can't remember if these particular ones were downloaded before."
1021,t3_wvr8ii,coursera,It's accurate. Stay away from them. They don't have an actual customer service that can be reached either
1022,t3_wupzuu,coursera,F2F
1023,t3_wu0xoi,coursera,Would like to know this as well
1024,t3_wu2c40,coursera,"I got 2/2 approved so far. I think I made an effort with the texts tho and as a full time student don't have too much money to spend on the side for online education.  
I guess it will be the same with you. If you convince whoever reads it that it makes sense for you to get the financial aid, you will get it."
1025,t3_wtk4cd,coursera,I finished the first course within the free trial period and I got the certificate and I wasn't charged.
1026,t3_wsgkl5,coursera,Cool. Congrats!
1027,t3_wsl4qe,coursera,"I just took a look and financial aid was still available for all those courses, can you tell the name of some of the courses that don't offer financial aid anymore?"
1028,t3_ws96dr,coursera,Data Visualization Best Practices by UCI right now and NO ONE has interacted with the class at all.  Unlike all other classes  I've taken here.
1029,t3_wrw3pt,coursera,"I use Coursera to get an overview of a subject. I recently took the IBM Data Engineer Certification but did not complete it. I don't mind not getting the certification as I don't think it is worth much in the industry. In my opinion, the only certifications that have value are those from vendors like Oracle, AWS, Databricks, Google, Microsoft, ...

  
Another reason that I think devalues Coursera certificates is that I now know how to work around the system. Whenever you want to complete a project, you have to submit your assignment. But before you can submit it, you have to grade 1 or 2 of other cadidates. In theory, this is a good move by Coursera.

  
BUT, I received some submissions from other candidates who just uploaded the same meaningless screenshot. And why? Because it allows them to see other candidates' assignments. Chances are very high that the majority will take this certificate seriously and put time and effort into the project/task. But the candidates with meaningless screenshots now have the opportunity to see the solved tasks, copy/paste them, reassign them and pass them, module by module. So I don't think you should expect too much from these Coursera certificates.

  
They are worth a little bit because at least they show that someone is willing to invest some extra (private) time in a subject and try to get ahead in their career. But that's about it."
1030,t3_wrwwv6,coursera,"If you've got the time and energy, and you enjoy it, why not? :D"
1031,t3_wqip6y,coursera,"why don't you just do this one

[https://www.coursera.org/degrees/bachelor-of-science-computer-science-london](https://www.coursera.org/degrees/bachelor-of-science-computer-science-london) ?"
1032,t3_wpolgp,coursera,Contact support.
1033,t3_wowkri,coursera,"If you need for job application forget all coursera stuff. I started the this course ans stopped after the 9th module. Scroll here un this groups feed, I think the spark module has a serious problem. After all I quit. 
This course isn’t bad as introduduction and giving an overview but that’s it. 
If you need a certificate for job application the only ones that really count are those from the vendors, like Oracle, AWS, Google, Microsoft, Databricks…. forget the rest."
1034,t3_woryqr,coursera,I don't think they give any certificate without payment.
1035,t3_wnpwtg,coursera,"No, you don't have to pay after receiving financial aid"
1036,t3_wnkbed,coursera,https://www.coursera.support/s/article/209819033-Apply-for-Financial-Aid-or-a-Scholarship?language=en_US
1037,t3_wmxhku,coursera,"There are two different things - the Specialization certificate (which you need to be a paying member of coursera in order to get) and the Google Certification itself, for which you need to take the exam. The specialization is to prepare you for the exam, but its certificate isn't the same thing as the Google Certified Cloud Architect certification.

Same applies to all the other specialisations that are prep for a certification exam. Google and others  (e.g. there's a Microsoft data engineering specialisation but that doesn't in itself give you the certified Associate Data Engineer Microsoft cert)"
1038,t3_wmu9v5,coursera,Having the same issue
1039,t3_wml795,coursera,[deleted]
1040,t3_wl12ks,coursera,Did you ask inside the discussion forms for help ?
1041,t3_wke6lb,coursera,"Hi. Its been 11 days since you asked but its your cake day rn so happy cake day. I am on week 3 of course 4 of the Duke university Intro to C spec and it has been great. Very frustrating at times, specially when you try to guess test cases from the given instructions. If you stick to the methodologies and take a lot of notes it won't be an issue, at least that works for me.

It's pretty basic right until pointers and malloc (courses 3 and 4) where it gets hairy but I've learned a lot and made me a better programmer overall. Other skills you learn along the way are git, algorithms, data structures, string manipulation, debugging, unix-like systems and emacs."
1042,t3_wk59ed,coursera,I finished it about two weeks ago. What’s up?
1043,t3_wjx9dm,coursera,"I think you can continue to look at the materials, but the course completion is still on the record associated with your account."
1044,t3_wjz9hl,coursera,"Why not jusst do both? Do the one they suggest, and then the one you want for your portfolio? Thats what I am doing."
1045,t3_wjvg90,coursera,"I have no idea if they will unlink your certifications if you end the paid subscription. I am also worried about it, but figure you should still be able to save/download the certification/badge and upload it yourself where you want it. I think the best work-around is to try to land an entry-level job before the subscription runs out and then no one will really care about the certifications because actual job experience should mean more than their certifications."
1046,t3_wjfrx7,coursera,I took the project management course and had the same thing happen to me. Just resubmit as is and wait to be reviewed again. You can go on the discussions and post your link too to bump it up so more people see it.
1047,t3_wjd34g,coursera,"This happend to me once with google cloud courses when they were free (on promotion).
Did you pay for this course?"
1048,t3_wjewcv,coursera,Was anybody able to finish that google analytics course? I found it painfully boring and not useful
1049,t3_wixnsa,coursera,"I have no idea which coarses are available.

But if you want to be a good and loved leader, you have to love your people. (To love =&gt; putting energy into improving the welfare =&gt; less stress / depression =&gt; people are happy and energetic people and want to improve global welfare).

So psychology and philosophy. You need to fill the basic needs of people so they have room to fulfill their other needs and the needs of the world. 

You can see countries as individuals, just as people. With their own traumas and needs. World leadership is knowing what each individual country needs to grow into the best version of itself and guide them to the right path."
1050,t3_wia6uv,coursera,AFAIK you only get charged for the time you use. So finish it in one month &amp; you save a lot.
