,link_id,subreddit,body
0,t3_y09o1m,edX,"Financial aid just gives u a discount, you still need to pass the course to get the certificate. Very rarely they change the passing grade, so more people can pass. But financial aid has no influence on this"
1,t3_xxluk0,edX,"Not necessarily. Assignments are only for certificate students, and when creating a course it’s possible to restrict individual course pages to certificate students only. Some courses I’ve been involved with have about 10-15% of the material unavailable to auditors."
2,t3_xtm1ea,edX,"You can just access archived courses even if not enrolled, but not purchase anymore or do graded assignments"
3,t3_xsaqli,edX,Cs50 python is more about learning the python language and is probably easier. It has less explanations though and reasoning about computer science. Cs50 teaches you more about theory and would make you a better programmer. You also learn some python in cs50. I’d recommend doing both and cs50 first.
4,t3_xseepw,edX,"I’m taking it. I don’t like it but I will complete it. Seems like a mediocre course to push their ibm cloud platform which isn’t very popular in the industry, but might be if you want an ibm job. 

At the same time you will gain some knowledge and understanding of how cloud applications work.

It does not teach coding in any shape or form. So if you need to learn coding, you must do it elsewhere. You may be able to take the course without much coding knowledge, most things seem to be cut and paste (keep in mind I have experience in most of the languages they used so I might be overstating).

Overall I have been underwhelmed by all ibm edX courses so far."
5,t3_xr7z6f,edX,Google
6,t3_xpp0w7,edX,"Cs50, there’s a lot under there that has those topics"
7,t3_xipyvx,edX,Happened to me also today. Usually changing browser fixes it but not even clearing cache worked. I think we just have too wait for a bit. Probably an issue on their servers
8,t3_xcntgz,edX,Unless you are required to have a verified certificate (like from an employer) I don’t see why you need the edX certificate.
9,t3_xboq27,edX,"Explain this to edx (you can request a refund)
If there is no way to do this then open an edx ticket and/or explain this to the staff of your course.

If you stress the fact that due to a disability or obstacle you are not able to do the course they will understand."
10,t3_xa73u1,edX,"For me it's not that you can't learn the uni content elsewhere, it's just more convenient to have it all in one place with a verbal explanation, especially starting out in a subject."
11,t3_x8tvl8,edX,"Honestly, YouTube tutorials. I found a lot of help from just searching on YouTube and finding a walkthrough."
12,t3_x1v361,edX,"My understanding is that they used to allow that before but moving forward you need to take the exam at the end of the same term you start taking the class (if you take micro this fall, you need to take an exam by the end of the term, you can’t in spring.)"
13,t3_wztpeg,edX,"I feel it would (I'm doing it), as it can show a potential employer that you are taking the initiative to learn what you need for the job you want (and if you don't have a background in the field, it helps build a background)"
14,t3_wzu3li,edX,"Like do you mean can you send them a copy?

You could go to EDX, and view your certificate. Then press the button to print and download it as a PDF. Then share the PDF."
15,t3_wzmbd8,edX,"Use the mobile app.

[How to run Android apps on Windows 11](https://www.androidauthority.com/android-apps-on-windows-11-3048569/)

There is no other way that I know of"
16,t3_wz7aja,edX,If you have an ios device you can stream to atv from the device.
17,t3_wwj67j,edX,how do u know that mit is moving its courses?
18,t3_wwlkxi,edX,"""10:00 -5"" means 10 AM Eastern Standard Time
-5 refers to UTC timezone
See this link https://www.ge.com/digital/documentation/meridium/V36160/Help/Master/Subsystems/AssetPortal/Content/Time_Zone_Mappings.htm

MAKE SURE TO CONVERT TIME TO YOURTIMEZONE OTHERWISE YOU MIGHT MISS SUBMISSION DEADLINE."
19,t3_wsy2da,edX,Mind giving a link to the exact course you are asking about?
20,t3_wrmm03,edX,"I'd definitely audit for free. It's a great course btw. They also offer a free certificate, you can read more about that [here](https://cs50.harvard.edu/x/2022/certificate/)."
21,t3_wmiiph,edX,[deleted]
22,t3_wmm1f5,edX,"You have to compile the file with ""`gcc -o name name.c`""

&amp;#x200B;

With ""`make`"" you can compile the file after compile with ""`gcc`"""
23,t3_wkohgu,edX,Of course the certificate is a positive.
24,t3_wk3wg6,edX,"Hello, they'll offer it next year. You can check the timeline here on MITx's website: https://micromasters.mit.edu/ds/upcoming-dates/ 🙂"
25,t3_wjrsh3,edX,"Not worth it, apply for financial aid pretty easy to get if you really want the cert"
26,t3_wic5h5,edX,Just do one of them. No need to do a ton of research. I did CS50 (the original) and 6.00.1x. Both excellent starting points.
27,t3_wh18dn,edX,I was actually looking at this course to refresh my abilities with programming before starting my masters. What YouTube resources would you say are better than the two intro courses?
28,t3_w5rry2,edX,"I believe im doing the same one, the UC San Diego Micromasters Program: Data Science. 

Its made of 4 courses. I've completede the first 3, missing the 4th, so cant say anyting about it. 

If its the same program, then you basically sign up to the first course, complete it, whenever yo have time, you sign up for the next, and so forth. 

When you complete you get a citificate of completion i think? I did with other multi-course things i've done on edx.

I think so far i've spend a year doing it slowly. I believe a single course would take up a lot of your time for 2-3 months, if you only have the nights.

Probability and statistics has been the worst of them so far."
29,t3_w3khh6,edX,"I did that and when I saw the difficult of both courses I unenrolled on the statistics. I highly recommend you to do so in until the deadline to do that having a refund. To get a refund you have to unenroll until the date they inform.
The course of probability seem easy at the beginning but the difficult escalate quickly. And a good resource to aid you is the playlist of the probability course on YouTube."
30,t3_w3j4fb,edX,I don't think you'll require any maths for it. They teach you some probability and statistics in the course itself. Basic high school stuff is more than enough.
31,t3_w0xxvg,edX,"I recommend you to ask your doubts in r/cs50
Also here is a relevant post:

https://www.reddit.com/r/cs50/comments/kb1rvh/what_will_happen_if_i_dont_finish_cs50_by_the_end/?utm_source=share&amp;utm_medium=ios_app&amp;utm_name=iossmf"
32,t3_vzn01s,edX,I guess using a different account works
33,t3_vz1ydr,edX,Yes
34,t3_vyzhn9,edX,"Bulk download means using a script or GUI program to download files en masse; you can definitely legally use their videos (that have the license you mentioned) in your study - I’ve had several instructors use videos from them and/or similar sources. Just be careful if you decide to bulk download instead of whatever method they offer to download those vids: 

r/Privacy

r/DataHoarder"
35,t3_vyb6px,edX,"this format works for me: (37\*x)+29500

&amp;#x200B;

so including parentheses around multiplied portions and omitting the y= or equivalent should help"
36,t3_vxfwrt,edX,I took all 4 classes in the micro masters already. The most important prerequisite math you need is linear algebra (used in 3 classes). Basic calculus is enough.
37,t3_vwvkzg,edX,"Go for It Bro, i used the same essay for 6 edx courses and a couple of coursera courses aswell"
38,t3_vvqkr7,edX,"I'm interested in this course too, I couldn't find any review of it"
39,t3_vshrcx,edX,"I am taking the MITx Micromasters in Supply Chain Management. With this certification, I can apply to Harvard’s Extension School and don’t have to take four classes in the Masters of Sustainability. However, the benefits of the education and the skills I have learned far exceed the name on the classes. Employers want skilled workers that continue to learn - the style is really not the important part."
40,t3_vq8xf8,edX,"In short, no"
41,t3_vpn2rt,edX,Just give an intro to yourself .then mention your income or your parents income and how purchasing the course for the original price would be a financial burden on you.Elaborate the financial part thoroughly .Answer the other questions like how this course would help you and how you've prepared  for the course beforehand.They are lenient with discounts and you'd be sure to get it.You'd get 90 percent discount if it approves .if you have any other queries feel free to dm.
42,t3_vo9eo3,edX,Those dates are just recommendations to keep you on track. You just need to complete before audit access expires.
43,t3_vhp11b,edX,"Could you tell us more about this course?
Is it from a university, for example?

My general experience is that the first week takes a month or two, but it gets better from there."
44,t3_vhaoii,edX,The email will only be sent for the actual proctored exam.
45,t3_vfm1bc,edX,"If the content on the whiteboard had nothing to do with the exam, they'll probably not do anything. But I can't say for sure. 
Just saying there shouldn't be any reason to cancel your exam. However, I would suggest that you be careful about errors like these in the future."
46,t3_vejti8,edX,"I'd doubt it affects your enrollment in the future. It's possible the TA is just trying to clean up the roster and because you haven't touched it, it looks like you signed up but never followed through. Edx does have comprehensive metrics , so it does affect the courses ""success metrics"" if they have dud enrollments because it lowers their participation rates and rates of completion."
47,t3_vbrscn,edX,"I do not believe the certificates themselves provide *that much* value to the CV. What is better to add is projects and so on made using what you have learned.

A way I recommend is best for this is take the homework/projects within these courses, do them to pass the stages, but also in a separate file take the techniques and solve a different similar problem, and perhaps even extend it.

Example: suppose 'introduction to programming' gives you problems with csv files where you are plotting some financial data and computing means etc.

Then a smart 'new' project using this material is to find a data API such as yfinance or federal reserve API to compute some things with their data. You will find you have to be a lot smarter than with the 'perfect' data sets in a university course as you will have to remove lines with missing data, strange shapes of arrays, and so on. This is where the real learning happens."
48,t3_vb0aot,edX,"Did you ended up taking the course?
Edit: thinking to take it before I start my program so I can know basics."
49,t3_v4mgnw,edX,No only one time and limited time validation
50,t3_v35f7e,edX,Can you contact the professor? They teach both so should know.
51,t3_v1k44q,edX,How do you see this information?
52,t3_v0rvls,edX,Yes. Done it many times.
53,t3_uy4rbm,edX,"The main difference between them is, that in Coursera by applying for financial aid you can get the whole course for free but in EDX it is not free, you have to pay some price. However, you can still get some discount on EDX by following a specific procedure."
54,t3_uxh33y,edX,"I would say both would have zero impact on your CV. These courses can be enrolled by anyone.

Enrolling in a summer school program in MIT/ Harvard may have a little but not much."
55,t3_uxbvs2,edX,"Im taking nr. 2, and I have to say, some of the courses, are the worst i've tried with online courses so far."
56,t3_uxbska,edX,I'm taking it now actually. Only on the first class though. So far it's been ok.
57,t3_uw0ox0,edX,"EdX was acquired. That doesn't mean it's going away, at least for now."
58,t3_uvftm3,edX,That’s a good question! Economics is a pretty broad field…anything specific you want to start learning?
59,t3_utfi65,edX,What's your background? Did you study anything before?
60,t3_uqa665,edX,"need more career options are very limited,"
61,t3_uo4etb,edX,"You can start with CS50, or 6.00 by MITx."
62,t3_ung46v,edX,It is worth if you have your studies followed up with experience. Once you step into the corporate world youll feel the difference.
63,t3_unecwu,edX,MIT seldom misses. However i had taken The UMich course and it was quite good as my first course.
64,t3_ulnhjl,edX,"This isn't an official support channel, you should definitely contact edx directly.

https://courses.edx.org/support/contact_us"
65,t3_ufwgtu,edX,"Creat new account and enroll for free, edx now is pushing everyone to pay for courses, me myself had similar issue where i enrolled on course about finance, didn’t get the time to finish it before deadline so my access to videos and material get revoked even after resuscitations, but once I created new account i could access the course for free"
66,t3_uc9z7n,edX,"KNOWLEDGE IS FREE NOT CERTIFICATE.

You can do courses for free but will not allowed to take graded exams and therefore will not receive official credits or certificates.
If you want to get certificate to prove someone that you did course, you need to pay for it before starting or in first two weeks.
Not all courses done on edx accepted by all universities around the world. So you need to do more research, what's your goal and what need to be done."
67,t3_u0r36s,edX,Are you doing the free version or paid? The amount of time you are allotted depends on whether you pay or not.
68,t3_tmtph6,edX,"I don't know which country you are but just enjoy your time in high school and do the learning for fun! University courses have some differences with edx or other same companies courses! Also, finding a job in future has more to do with networking than knowledge. I think instead of going deep into the field of study, try different things. For example I saw that Python developing is quite useful in not only software engineering but also in other fields so it would be good idea to learn it from YouTube. The other thing is asking this question in a better place may be more beneficial for you. Find some expert in the field you want to study and ask them."
69,t3_tes02u,edX,"I did! I applied for financial aid for a course in a MITx MicroMasters course, explained why the program was going to benefit my career, and they approved a 90% financial aid coverage - I ended up paying about $20 for the course."
70,t3_tc95lx,edX,"There are 2 courses afaik. Cs198.1X &amp; Cs198.2X. I took the former,. It focused on the origins , fundamentals &amp; near future applications of blockchain. It helped me a lot when I started out. The 2nd course focused more on advanced topics like concensus etc."
71,t3_tanoko,edX,[deleted]
72,t3_ta4ard,edX,"Hi, the deadlines for approximately half of the assignments have already passed and even if you start you won't get a certificate. It is also a very popular course, so there will definitely be another session after this one ends. I took it a couple of years ago and I highly recommend it as well."
73,t3_t81v8c,edX,"I've just started this course and discovered  no posts on reddit about it. I'll be bringing my problems or answering any questions that may come up during course.
Thank You"
74,t3_t4d8su,edX,I started with SC0x. I’m willing to put in the time and effort but it’s been 30 years since I last had an algebra lesson so I’m really struggling with it. I’m very good at excel though. I can write complex excel syntaxes just fine. I’m looking for an algebra tutor. Hopefully that will help me get through the course.
75,t3_sy4cjo,edX,It is also missing ratings. Have done some absolute horrible courses that I would have preferred to have avoided
76,t3_swe2uu,edX,"You can get a certificate, but that means you need to a certain amount of money. The amount differs from courses to courses. For details on which universities will accept the credits potentially, refer to their Q&amp;A page. https://support.edx.org/hc/en-us

Some edits made to add link."
77,t3_sv6xe0,edX,Excited to hear your feedback and ideas there! :) appreciate the support! :)
78,t3_sqzhc4,edX,"I think even if you upgrade, you still won't be able to access the course until the day it starts. At least that was the case with my differential equations course from MIT."
79,t3_sp99st,edX,"If your sole purpose for aquiring knowledge is employment, edX is probably not the right choice for you."
80,t3_sm1ni4,edX,"Hey, someone posted a response in here but it's gone now! Would love to have read it. Said something about an email being sent out"
81,t3_skqght,edX,"The courses used to be $50 each but had a price hike a few years back, I agree that it’s too expensive now!"
82,t3_sin76z,edX,"I don't think that it would be possible in any country, but you haven't even wrote where you are based so how are people supposed to know what are the rules?"
83,t3_sicloy,edX,"It surely requires a lot of math. Check out khan academy, that'll help"
84,t3_shzlsw,edX,"It should be said on each course specifically.

MIT's uMaster S&amp;DS is ""instructor-led on a schedule"", which means you have assignments with deadlines. (week to week, and each course they tell you how much time is expected each week, which is around 12 hours average I think)

The professional certificate you showed writes specifically ""self paced"", so no week-to-week deadline there, just at your own pace."
85,t3_sgf5us,edX,"You can audit a course means you will not get course certificate but will get knowledge.
If you pay for course than you will get course certification and also can count towards a program. 
So if you get certificate you can share on LinkedIn or elsewhere but not in other case.
Hope this will help!"
86,t3_sf1yqf,edX,"https://micromasters.mit.edu/documents/103/2022_calendar_jan31_2022_final.pdf
As the schedule shows it usually does not have long breaks between courses. I would not reccomend taking more than one course at once."
87,t3_seubce,edX,"Did both courses and highly recommend. Whether you want to pay for a verified certificate is up to you. If it is cheaper to buy separately do that you still get the professional certificate. I did it this way just because I did the games one a year or more later. I would double check the prices though, they may have increased the cost for a course, it’s unusual to be more expensive to do the bundle."
88,t3_sd7w0a,edX,I started in the data science MM due to its ability to apply toward a data science masters at Harvard Extension School but ended up switching to the supply chain management MM to go for the Sustainability masters. The statistical modeling class just started in the last two years as it wasn't an option to pick when I took the data analysis class. I would highly recommend taking the statistical modeling and computation class as the other class was an absolute mess.
89,t3_sd5htw,edX,"If you are removed from a CS50 course for suspected plagiarism, that ban on further participation is permanent, as discussed in the course's zero-tolerance policy (agreeing to which is part of each assignment). You are still eligible to take other CS50 courses, but not the one you were removed from."
90,t3_s7pjbl,edX,"Yes, you can do that.  
Just make the changes around the need to do a particular course"
91,t3_s4bs3u,edX,"You will never get everything in one package in life.

Getting a degree is as important as having a related skills.

You might be able to start your career with certification or bootcamps but its good idea to have degree that will showcase your fundamental knowledge in the field and also jobs were degree is required, you can apply there as well.

I might be wrong."
92,t3_rx6hla,edX,I had the exact same issue. The video is taking ridiculously long to load for such a small video file... Its honestly extremely annoying.
93,t3_rwxuls,edX,"Well, I've done CS50 and MIT intro to CS, and now... I'm not sure what would be my next step. I'm in my 30s, I don't see this as turning into a ""real job"" anytime soon. What next course would you recommend if you wanted to keep learning to code? I wanted to keep going and go either Machine Learning or Blockchain, but mainly to be literate, and not to ""one day write a ML program"". I just can't see myself doing it. If I could, I'd be in my 50s by then, 20 years from now. 

I totally love using python for small automations in my personal life, but I can't imagine myself being a dev as a professional."
94,t3_rvvohi,edX,Yea I too had this issue and I just asked for an update and within 24 hrs I got the discount code.
95,t3_ru5n3s,edX,It sometimes lets you roll forward sub-deadlines a little but I think the course expiry is the hard deadline.
96,t3_rsa0xc,edX,[class central](https://www.classcentral.com/)
97,t3_rqwwky,edX,"Edx has mobile apps, in that you can put all videos into list to download and can watch offline."
98,t3_rp64at,edX,"Hi! I just finished the first of four courses that are part of the program. The first one, and I think the others are similar, lasted 3.5 months with average 10-14 hours a week that a student needs to spend on it. 

I'd recommend you to start with one course first and see whether you stick to it, you can even start with a free version that doesn't provide a certificate. Machine learning with python certainly required college level calculus and some stochastic. Luckily in the end of January there are two courses starting, statistics and probability theory. I could skip it because I already have a master's degree in mathematics but I don't know how much you have seen in undergrad economy. 

You should probably be able to finish the four courses until 2024 taking one course per term, maybe even faster if you have more time on your hands. I don't know how the final exam is scheduled though. 

Feel free to ask further questions!"
99,t3_rn0mzm,edX,"I work at a college with an accelerated schedule.

We offered pre calc for the ""J"" term (which was offered in the month between semesters).  We typically would only allow students to do it by itself. (usually they could do 2 J term).  We also had them in a study group.

How good are your math skills?  How determined are you really? Do you have any support?  


Is it possible?  Absolutely.  But you have to be realistic with who you are."
100,t3_rel9bj,edX,"Please give course name, id, description etc."
101,t3_rb7g03,edX,pause the lecture and google it.  I'm native english and I often look up words this way.
102,t3_ra0uze,edX,"This is a problem I just barely avoided. I had lined up a few professional certificate programs that I was going to take for the year but when it came time to enroll and pay for them I decided to check the individual courses first. Many turned out to be ending next month so I never would've been able to earn the certificates in time, and some of the courses in the programs were already archived. Yet, I was one click away from paying for the whole program with nothing to stop me or prompt me otherwise.

So I had to change my plans and miss out on 2 prof.cert. programs that I was really excited about taking. But the main concern that I had was what if I didn't see the end dates and archived courses in time? I would just be sitting in the program until new sessions become available, or I would've just wasted my money.. They should really do something to avoid this. and/or you should be able to get a refund."
103,t3_r9ciy8,edX,Maybe try getting financial help? They'll give you 90% off a course you choose
104,t3_r3jk3h,edX,"At the time that I took it, you just needed access to the book (pdf or hardcopy.) They usually recommend you just rent it, instead of buying the lifetime one."
105,t3_r34klo,edX,You need to apply separately for each course.can't apply for all of them together.
106,t3_r02d25,edX,I’m a little late but if you took it how was it? I have a feeling it is going to be mediocre
107,t3_qzmda6,edX,ingilizce yazman gerekir büyük ihtimalle
108,t3_qrax54,edX,"i really want to know when will old material resource be upload on their new platform.

6.005 and 6.004 series can not be found on edx right now, so we just lose these open free courses before they finally upload again."
109,t3_qpnvqu,edX,"I am sorry to hear that bro. A lot of courses have disappeared this year.l, the one that I wanted to buy is gone.
I would recommend you to contact edX support, I know is the basic advise but is the only thing that you can do"
110,t3_qol1pw,edX,https://www.edx.org/new/course/the-hook-the-bait-and-the-fish-approaches-to-teaching-thinking
111,t3_qngaaq,edX,"If I remember, when you take the exam, when the system doesn’t detect the software, it gives you the option to download proctortrack again. Also I think you just Google proctortrack and get it from their website directly."
112,t3_qmd149,edX,"MIT sold edX to U2. As a result, a lot of courses from MIT are now leaving edX. You might want to take a look at MITx Online. It might have been moved there."
113,t3_qkfi72,edX,You can start it whenever you want. I'm doing it right now too except I'm auditing the course i.e. not paying for the certificate
114,t3_qdawo7,edX,I also have similar issue and solved it with using another browser (firefox in my case).
115,t3_qc0d5m,edX,"hey I have taken this course with the certificate and I really recommend it. I love psychology, mostly social psychology ,and I was desperate for a course to properly learn it as we weren't learning it at school. This course was definitely worth it and not too complex to understand either. Go for it!"
116,t3_qaiph7,edX,"Have you checked MIT's Opencourseware?

Edit: https://ocw.mit.edu/search/ocwsearch.htm?q=electricity%20and%20magnetism"
117,t3_q8h8k4,edX,Physics and mathematics. Good lecture there.
118,t3_pxxytt,edX,Absolutely.
