,link_id,subreddit,body
1249,t3_td2nh6,coursera,"Yes, this course was taught by HSE instructors. (I have no idea what role UC San Diego played in producing it, if any at all.) I thought it, and the other related courses, were good, but unfortunately, it will be unavailable at least as long as sanctions are in place.   

Coursera tried to ride the woke train and said they're doing to support Ukraine, but they are not allowed to offer services to countries that the US has sanctions against. There is a small handful of countries that they don't serve for this reason. Their dishonesty and hypocrisy leaves a bad taste in my mouth."
1250,t3_td496s,coursera,Yes that is possible..
1251,t3_tcsrrs,coursera,"If you plan on to getting a job, a certificate might help so in this case you should go with Coursera."
1252,t3_tbgz38,coursera,"(Also, what's the trick to having linked image show up on the reddit post, rather than just the link?)"
1253,t3_ta5zqg,coursera,If I understand your question correctly. You are asking about specialization provided by Russain university HSE. Coursera decided to suspend all Russian providers from the platform. Please check - [https://blog.coursera.org/coursera-response-to-the-humanitarian-crisis-in-ukraine/](https://blog.coursera.org/coursera-response-to-the-humanitarian-crisis-in-ukraine/)
1254,t3_t99jfh,coursera,"Make a timetable. Allot your hours. If you cannot fit in both the courses, take them with a gap. :)

People apply for Scholarship for those certificates."
1255,t3_t8tikn,coursera,I guess because Yandex is a partner of the course.
1256,t3_t83cpc,coursera,"Am currently in the visualisation course, few to go. Am already concerned about the last course though it might be a tiring one. Anyone who took and passed it here ?"
1257,t3_t728n9,coursera,"I am pretty sure the wast majority of Russian users of Coursera were people of liberal views, anti-Putin. Because in Russia, the knowledge of English usually correlates with openness to the Western culture and being lib-minded. And pushing these people is stupid and benefits only the Kremlin propaganda machine."
1258,t3_t7ligo,coursera,"I received a response to this (Reddit) post via email notification, but can't find it here to reply to them in the thread.

Anyways, I still haven't received a response from UIUC, and decided to pause on going through with the program. Frustrated, since it's been 6 days."
1259,t3_t7bit7,coursera,"You might be able to get more help in the dedicated discussion forum. 

Here it says that two properties are not defined.

Debug your program and see do you have null values for anything.   
Is the path to the image file correct ? I'm guessing that the path isn't correct."
1260,t3_t6b08g,coursera,I don't think you can upgrade you will probably have to cancel the current billing and purchase the subscription when your current monthly subscription ends.
1261,t3_t5v8tw,coursera,Course Central
1262,t3_t6692q,coursera,"What is the DNS server you are using? Change DNS and check.  Sometimes it is a DNS issue. Also see if you can ping [coursera.org](https://coursera.org) on cmd. Command is 

&gt;ping [coursera.org](https://coursera.org) 

If it is reachable with a response, then there is a chance it is DNS issue"
1263,t3_t5sjw6,coursera,Were you able to get any help with this ?
1264,t3_t5diei,coursera,"And - I want to stress - I HAVE seen, and used, this page here  
[https://www.coursera.support/s/article/360036160591-How-to-contact-Coursera?language=en\_US](https://www.coursera.support/s/article/360036160591-How-to-contact-Coursera?language=en_US)  


What do I do when THAT leads nowhere ( especially as my issue does not have to do wtih Coursera 'Plus' - at least I don't think it has anything to do with Plus ?"
1265,t3_t4710m,coursera,"Did you have to submit the code as is as part of the assignment and your changes in a screenshot only, without attribution in the submitted code? That’s usually the reason for plagiarism, an autograder."
1266,t3_t454qb,coursera,Heyo! I'm also learning Google UX Design. I'm done with the 2nd course and am currently taking another course while waiting for my financial aid approval for the 3rd course. Would love to connect! 😚
1267,t3_t3q5xw,coursera,"You can specify yourself in the FA application how much you are able to pay. I put 0$ on the Stanford Machine Learning course and git full financing in 15 days.

Just write honestly and accurately. Coursera is lenient in these matters."
1268,t3_t3qf53,coursera,"Can you please explain your issue ? 

What are you trying to do ? 

What isn't working ?"
1269,t3_t35ex3,coursera,"Just follow the instructions, write honestly and provide a detailed response/reason/motivation. Coursera is very considerate when it comes to financial aid, just make sure to actually finish the courses you requested financial aid for."
1270,t3_t2wnfa,coursera,Which course are you referring to [AWS fundamentals](https://click.linksynergy.com/link?id=E2ohh2tPwRI&amp;offerid=916798.18533796022&amp;type=2&amp;murl=https%3A%2F%2Fwww.coursera.org%2Fspecializations%2Faws-fundamentals) ?
1271,t3_t22ue4,coursera,"UX 
I got a certification and while I don’t have a job , it’s opened me to a new world and I’m happy I did it"
1272,t3_t1yygx,coursera,"Yes you should be able to switch and get credit for your work for those courses.

I would recommend you finish up the courses of interest in the specialization you have paid for then start the new specialization.  You will have to pay for the new specialization subscription but since you’ll have credit for 2 courses, it shouldn’t take you as long."
1273,t3_t0k7aq,coursera,"Go to [Coursera Support](https://www.coursera.support)

Make sure to login. 

Chat bubble should appear in the bottom right corner after you login.

I believe the chat bubble only appears during certain hours, I'm guessing US time zone"
1274,t3_szto97,coursera,"Yes, I have. Wasn’t directly related but it showed skills that put me in the top percentage of candidates."
1275,t3_sz4hb6,coursera,"You can only apply for financial aid for one course at a time, so you will need to submit one for each course in the specialization."
1276,t3_sz88i4,coursera,Which course are you referring to ?
1277,t3_sz4ie8,coursera,"Yes, a free trial is exactly the same as the paid experience. If you complete a course or specialization within the free trial, you get the certificate for it."
1278,t3_syitl1,coursera,You cannot get free certificate.
1279,t3_svtpyr,coursera,Can you clarify what you mean by all your skills? What are you trying to do exactly ?
1280,t3_svg94o,coursera,Did you contact support ?
1281,t3_sto6jo,coursera,I know that course and I think the course assignments are way too hard. They should split the assignment into little ones and offer them step by step. Maybe try google python course.
1282,t3_sta1r4,coursera,There is courses from ilnois universty and NY univesrty  and san digo universty chouse what you like from them
1283,t3_st92g7,coursera,On my side I can enroll in these courses.
1284,t3_srjulr,coursera,You just ask for another financial aid. Did it multiple times and it worked. Just say you couldn't finish for whatever reason.
1285,t3_srcnus,coursera,"Hey! There’s actually a way around this. If you go to Discussion Forums and choose the week you are currently working on, you can see people are posting links to their assignment asking to be graded. You can grade those ones! That’s what I do."
1286,t3_sqnvav,coursera,"I believe you can only audit one course per subscription. In the past I wanted to switch cards on Coursera, when I removed the card I lost access to everything, maybe contact support to get help from them."
1287,t3_sqgutl,coursera,"If your application is approved, you'll get an email letting you know, and you'll be automatically enrolled in the course. Courses have personalized deadlines, so you won't need to worry about falling behind. 

If you do not complete the course within 180 days, you may submit another application.

Reference: [Approved applications](https://www.coursera.support/s/article/209819033-Apply-for-Financial-Aid-or-a-Scholarship?language=en_US)"
1288,t3_sqcukw,coursera,[removed]
1289,t3_spwd7a,coursera,"Hey, while not directly tied to your question, I just wanted to say sorry for that experience. I‘m in a business role where I look at lots of CX data from the car dealership field. Unfortunately we see the woman = incompetent dynamic way to often. I know that you want to be respectful to the customer and stay on top of your game and that’s great. But please keep in mind that, judging by this comment, the humiliation wasn’t tied to your technical knowledge and more to a really really shitty gender stereotype. So pls don’t judge yourself to harshly! The fact that you actively look for resources to improve is a strong indicator for me that you are doing a great job! Don’t let some ahole ruin that for you."
1290,t3_spp98q,coursera,Did you try in the discussion form ?
1291,t3_spg4i2,coursera,yes you can
1292,t3_spenk0,coursera,"Hello! I just finished this specialization.


For this specialization you don't need any specific software, until the last course where you'll need ro download and install R and Rstudio (but don't worry, you'll get all the instructions once you get there). 


The whole specialization is very straightforward, you'll get all the info you need from the videos and specified recommended readings. There are no peer graded projects, only graded quizes, one for each week and a course challenge quiz. Almost every course is 4-5 weeks long and only one is 6 weeks long, but it's easy to finish then in way less time.


For the first courses you'll be using mainly google sheets and google cloud (for SQL, in one course they'll give you instructions to access for free), you can also use MS excel if you want instead of google sheets.


For note taking you can use simply pen and paper or take digital notes if you like. The quizzes are not that hard. 


Consistency is key, set up a specific time of the day for learning and stick to your schedule. If you ever get stuck check out the discussion forums or look up info online, but you probably won't need more material than what is presented in each course.


Good luck and have fun learning!"
1293,t3_spbei1,coursera,"When you cancel a subscription to a Specialization

- You won't be able to access paid course materials in that Specialization, including graded assignments

- You will keep any Certificates you earned while subscribing to that Specialization"
1294,t3_sonb9m,coursera,"You can apply for scholarship for single Coursera courses. Fill out there application forms on the enroll page of the course you're taking, and it'll take 14 days to get approved. Remember to finish every course that you applied scholarship for."
1295,t3_soere9,coursera,Did you contact support ? What happens when you try to login ?
1296,t3_so0sit,coursera,"The error I am receiving is  

iPS C:\\Users\\MoneyFay\\dap2022&gt; python craping1.py  
Traceback (most recent call last):  
  File ""C:\\Users\\MoneyFayweather\\dap2022\\craping1.py"", line 1, in &lt;module&gt;  
from urllib.request import urlopen  
  File ""C:\\Program Files\\WindowsApps\\PythonSoftwareFoundation.Python.3.9\_3.9.2800.0\_x64\_\_qbz5n2kfra8p0\\lib\\urllib\\request.py"", line 88, in &lt;module&gt;  
import http.client  
  File ""C:\\Program Files\\WindowsApps\\PythonSoftwareFoundation.Python.3.9\_3.9.2800.0\_x64\_\_qbz5n2kfra8p0\\lib\\http\\client.py"", line 71, in &lt;module&gt;  
import email.parser  
  File ""C:\\Program Files\\WindowsApps\\PythonSoftwareFoundation.Python.3.9\_3.9.2800.0\_x64\_\_qbz5n2kfra8p0\\lib\\email\\parser.py"", line 12, in &lt;module&gt;  
from email.feedparser import FeedParser, BytesFeedParser  
  File ""C:\\Program Files\\WindowsApps\\PythonSoftwareFoundation.Python.3.9\_3.9.2800.0\_x64\_\_qbz5n2kfra8p0\\lib\\email\\feedparser.py"", line 27, in &lt;module&gt;  
from email.\_policybase import compat32  
  File ""C:\\Program Files\\WindowsApps\\PythonSoftwareFoundation.Python.3.9\_3.9.2800.0\_x64\_\_qbz5n2kfra8p0\\lib\\email\\\_policybase.py"", line 9, in &lt;module&gt;  
from email.utils import \_has\_surrogates  
  File ""C:\\Program Files\\WindowsApps\\PythonSoftwareFoundation.Python.3.9\_3.9.2800.0\_x64\_\_qbz5n2kfra8p0\\lib\\email\\utils.py"", line 28, in &lt;module&gt;  
import random  
  File ""C:\\Users\\MoneyFayw\\dap2022\\random.py"", line 3, in &lt;module&gt;  
prob = random.random()  
TypeError: 'module' object is not callable"
1297,t3_snfzt9,coursera,Try another browser
1298,t3_snlume,coursera,"You can, but some of the certificates require extra assignments compared to auditing the course, so you'd have to complete those before you can get the cert (if that applies to your course)."
1299,t3_smx8jh,coursera,Maybe try to verifying it by a smartphone that has good camera. Also some countries have different type of ID so maybe your ID not applicable.
1300,t3_smv2bl,coursera,"Is it a specialization? If so, you'll need to apply for financial aid for each individual course within the specialization. I'm not sure if you can apply for all of them at once, so keep the 2 week turn around time in mind as you move forward"
1301,t3_smpw3e,coursera,The majority of specialization have a free trial
1302,t3_smi9t1,coursera,"Sometimes there's bugs in quizzes, maybe see inside the discussion form if anyone else has the same issue ?"
1303,t3_smio0l,coursera,"Go to [Coursera Support](https://www.coursera.support/)

Make sure to login. 
Chat bubble should appear in the bottom right corner after you login.

I believe the chat bubble only appears during certain hours, I'm guessing US time zone"
1304,t3_sm3y5f,coursera,"Anything that is linked to your job requirements will be good to add to your CV.   
It can show the recruiter that you're motivated to learn relevant skills for your job."
1305,t3_sm2xa2,coursera,"[IBM Data Analyst Professional Certificate](https://www.coursera.org/professional-certificates/ibm-data-analyst) is going to be a different focus from let's say [Python for Everybody Specialization](https://www.coursera.org/specializations/python)

With Data analysis you're going to be focusing on using tools (Excel/SQL/Python) to answer some business questions. Learning to program you'll be focusing on the specifics of the computer language. 

If you have an interest in using data to answer questions I would maybe do the IBM course first. I think one of the key things when learning a programming language is to solve a problem you actually have."
1306,t3_sm1hqc,coursera,"Has anyone ever been able to contact a human customer service agent at Coursera ?

I quit Coursera's UX program for that reason out of my frustration."
1307,t3_slvbhi,coursera,"The certificate can be achieved for free. You can use either financial aid or audit the course then use the 7 day trial period to complete the assignments from all the courses in the cert

Speaking from experience, those two certs are worth it"
1308,t3_slziwj,coursera,"To get a certificate, you'll need to verify your identity. Most courses only need Name Verification, but some require ID Verification.

You only need to complete Name Verification once to get a certificate for any course you take."
1309,t3_slqstz,coursera,Did you apply for financial aid for every course of the specialization ?
1310,t3_sl4vxg,coursera,You apply for all of them separately and once they're all done you're awarded a specialization certificate. You do get a cert per course completed but they're not as relevant
1311,t3_sknnrj,coursera,"It's really unfortunate that there are people like that out there, especially when you've made a lot of effort. Maybe write into the discussion form about the issue and see if the mentors of the course can help."
1312,t3_skwvqy,coursera,"I did the Google Data Analytics Course, you have to apply for each course for financial aid, one by one."
1313,t3_skfnum,coursera,Does this happen via app or browser?
1314,t3_sk73tu,coursera,Coursera has dedicated discussion form you could use.
1315,t3_sk2vaz,coursera,Maybe ask here instead [r/CompTIA](https://www.reddit.com/r/CompTIA/)
1316,t3_sga4v8,coursera,Did you contact support ?
1317,t3_sf3lpl,coursera,"Just from months of scrolling/exploring  I'd say maybe 70% of the courses available are included. It's all just ""look up the course &amp; see if there's a blue PLUS icon next to it"" unfortunately

So far I've only encountered one or two courses (of my interests) that weren't included in Plus but I'm sure it varies from field to field, for example I know that none of the IBM classes are included"
1318,t3_sf0j5j,coursera,"Are there assignments? I think the latter makes more sense. If it has assignments then those would have been locked and will need to be submitted when financial aid unlocks them. If they have to be graded, then as long as there are other student assignments for you to grade (maybe about 6) then you should be ok. You would obviously need someone to grade yours as well."
1319,t3_sexyef,coursera,"1. They auto-cancel once you finish the course if you're going at a course-by-course basis.
2. You'd be paying twice potentially. This makes Plus an attractive option if all the ones you're interested in are plus (they'll have the plus logo on the course info page)."
1320,t3_seqh6y,coursera,"In my experience I've hit the ""reset deadlines"" button like 10 times and it hasn't negatively affected my progress, however I'm not familar with the Coursera Student set-up there might be a final ""expiration date"" (typically around 6 months after starting the course, at least that's how my financial aid approved classes worked)"
1321,t3_seqkqz,coursera,just write a text about what they ask and that's it.
1322,t3_secp20,coursera,"🧠**I am committing to completing the following courses:**🧠

● [Google UX Design Professional Certificate](https://www.coursera.org/professional-certificates/google-ux-design)

Approximately 6 months to complete

Suggested pace of _10 hours/week_

_I aim to study around 50 hours a week total, spread out over 5 specializations_


●[Michigan User Experience Research and Design Specialization](https://www.coursera.org/specializations/michiganux)

Approximately 9 months to complete

Suggested pace of 2 hours/week

_OR 2 months of 10 hrs/wk_


●[Cal Arts UI / UX Design Specialization](https://www.coursera.org/specializations/ui-ux-design)

Approximately 4 months to complete

Suggested pace of 5 hours/week

_OR 2 months at 10 hrs/wk_


●[UCSD Interaction Design Specialization
](https://www.coursera.org/specializations/interaction-design)

Approximately 10 months to complete

Suggested pace of 3 hours/week

_OR 3ish months of 10 hrs/wk_


●[Minnesota User Interface Design Specialization](https://www.coursera.org/specializations/user-interface-design)

Approximately 4 months to complete

Suggested pace of 3 hours/week

_OR 6 weeks at 10hrs/week_


🧠**I am also interested in these courses if I have the time:**🧠

●[Medical Cannabis: The Health Effects of THC and CBD Specialization](https://www.coursera.org/specializations/health-effects-cannabis-thc-cbd)

Approximately 4 months to complete

Suggested pace of 3 hours/week


●[Branding: The Creative Journey Specialization](https://www.coursera.org/specializations/branding-the-creative-journey)

Approximately 5 months to complete

Suggested pace of 2 hours/week


●[Transmedia Storytelling: Narrative worlds, emerging technologies, and global audiences](https://www.coursera.org/learn/transmedia-storytelling)

Approx. 26 hours to complete"
1323,t3_se4lo7,coursera,[deleted]
1324,t3_sdvrlf,coursera,"
It sounds like you are learning for fun, which is awesome! 

Just fyi, all courses are free to audit! So you get access to all the course material, just no quiz answers or certificate of completion at the end, neither of which are necessary if you just want to explore the material

Have fun 😎

Eta: i'm not in the STEM field at all, but you seemed excited to learn and I wanted you to know you can get started for free"
1325,t3_sda3dl,coursera,Having the same issue… did you talk to Coursera help to see if they had anything?
1326,t3_sd8kaj,coursera,It’s happening to me as well. And I can’t access the class I purchased meanwhile
1327,t3_sc4lw9,coursera,Just contact their support via chat.
1328,t3_sb4xzk,coursera,"[https://www.coursera.support/s/article/209818923-Age-restrictions?language=en\_US](https://www.coursera.support/s/article/209818923-Age-restrictions?language=en_US)

*You must be 13 years of age or older to use Coursera, unless you are a learner from the European Economic Area (EEA), in which case the following ages of consent apply:*

*16 years old: Belgium Bulgaria Croatia Cyprus Estonia France Germany Greece Hungary Italy Latvia Lithuania Luxembourg Malta Netherlands Portugal Romania Slovakia Slovenia 15 years old:*

*Finland 14 years old:*

*Austria 13 years old:*

*Czech Republic Denmark Ireland Poland Spain Sweden UK Learners under 18 years of age must have parental supervision.*

*We enforce these restrictions to protect the safety and security of minors, and ask for your understanding and cooperation.*

*This page is provided as a source of general information. It is not and should not be treated as legal advice. This list is current as of February 2018. The default age of consent for GDPR is 16, but some countries have set it lower. For those that have not specified, they are listed as 16. To confirm the age of consent in your country, please consult local guidance from the data protection authority where you reside.*"
1329,t3_sb08kt,coursera,May be if he purchase a prepaid credit card and pay with it
1330,t3_saa4o1,coursera,"From their website  : [Upgrade to a paid Course Certificate](https://www.coursera.support/s/article/209819053-Get-a-Course-Certificate?language=en_US)  
   
*Upgrade to a paid Course Certificate*  
*If you take a course in audit mode, you can upgrade to a paid Certificate at any time during or after your audit.*  
*If you pay for a Certificate in a course you’ve already taken, any grades you already earned will be saved, but you may need to complete more coursework that wasn’t available in the audit version.*  
*To upgrade to a Certificate in a course you're already enrolled in:*  
*Open the home page for the course you want to pay for.*  
*At the top of the page, click Upgrade, or scroll down to the Course Settings section and click the Purchase button.*  
*Make sure you’ve completed your Name or ID Verification.*  
*Not all courses offer Certificates. If you can’t find the option to upgrade to a Certificate in a course, it may not be available.*"
1331,t3_s9y9e2,coursera,Try a different web cam. I have issues with my Logitech web cam with proctored exams and verifying id.
1332,t3_s99jpz,coursera,"I’ve stopped my course and canceled my membership for that reason.
I will see if I go back…"
1333,t3_s98qqp,coursera,Your obstinance will just make it easier for people willing to put in the bare minimum to get financial aid. The system works!
1334,t3_s8ptq3,coursera,[deleted]
1335,t3_s8dy8w,coursera,Yes
1336,t3_s7tmn0,coursera,Ewww yeah and they aren’t included in the coursera plus sub either
1337,t3_s77maj,coursera,No issues for me. It might be something to do with your cloudfront edge location. You could use VPN to get around it.
1338,t3_s6xxfa,coursera,I'm guessing maybe the support is outsourced. The don't list any support roles in their [job portal](https://about.coursera.org/careers/jobs/)
1339,t3_s6numd,coursera,"Normally you need to select a specific course within a specialisation to see the reviews   


example : [Learner Reviews &amp; Feedback for Creative Writing: The Craft of Plot by Wesleyan University](https://www.coursera.org/learn/craft-of-plot/reviews)"
1340,t3_s5pvyj,coursera,Ideally your hosting provider (e.g. netlify) should provide some sort of script to run \`npm install\` for you
1341,t3_s5cr1j,coursera,"Hey, just contact support! That happened with me too, where basically my name was spelled wrong and they fixed it very quickly. They were very kind and helpful."
1342,t3_s4urtj,coursera,I've have the same issue. I just reported to coursera
1343,t3_s4shb1,coursera,Did you contact support or write in the discussion form?
1344,t3_s2z7z3,coursera,No.
1345,t3_s22rv6,coursera,Is it the one from Google? That course you don’t submit any work. You just select yes or no if you did it.
1346,t3_s1rbw5,coursera,"Never too late. I would think about what sort of things you want to be doing. Do you want to be using visualisation tools to look at patterns in data, or do you want to do programming work with Python?

Look at some job postings you would be interested in and see what skills they require, then find resources for those.

As for Coursera courses the Google Data Analytics specialisation looks good. I think it has a fair amount of Python programming involved but may teach you the basics to get going with it. If not take a look at a beginner Python course."
1347,t3_s1seqn,coursera,I usually go to Discussion forums to see if there are students begging to get reviewed there.
1348,t3_s1js4z,coursera,I have only seen it last New Year's and this New Year's. I don't think it came up in between these two times.
1349,t3_s19cgr,coursera,Nope
1350,t3_s18saf,coursera,"Well, you usually don't need any camera or lights to learn online."
